{
  "schema_version": "1.0",
  "file": "fixtures/verbose.md",
  "metrics": {
    "source_lines": 7,
    "prose_characters": 161,
    "paragraphs": 2,
    "sentences": 2,
    "headings": 2,
    "longest_sentence_chars": 117,
    "mean_sentence_chars": 80.0,
    "kanji_fraction_of_japanese_script": 0.331,
    "katakana_fraction_of_japanese_script": 0.2324
  },
  "issue_counts": {
    "ERROR": 0,
    "WARN": 3,
    "REVIEW": 3
  },
  "findings": [
    {
      "rule_id": "TERM001",
      "severity": "WARN",
      "line": 1,
      "column": 1,
      "excerpt": "サーバ, サーバー",
      "message": "用語の表記が混在しています。",
      "suggestion": "用語辞書に従ってどちらかに統一してください。"
    },
    {
      "rule_id": "SENT001",
      "severity": "WARN",
      "line": 5,
      "column": 1,
      "excerpt": "システムでは、APIサーバーが受信したリクエストの解析を実施し、ユーザー認証の結果を確認した後に、必要に応じて既存キャッシュの更新処理を実行することができますが、更新に失敗した場合には、状況に応じたリトライを実施することを検討します。",
      "message": "一文が117文字（目安90文字超）です。",
      "suggestion": "情報のまとまりごとに文を分けることを検討してください。"
    },
    {
      "rule_id": "VAGUE001",
      "severity": "REVIEW",
      "line": 5,
      "column": 50,
      "excerpt": "必要に応じて",
      "message": "基準が曖昧かもしれません。",
      "suggestion": "必要なら具体的な基準・条件・担当者を書いてください。"
    },
    {
      "rule_id": "STYLE001",
      "severity": "WARN",
      "line": 5,
      "column": 71,
      "excerpt": "することができます",
      "message": "冗長になりやすい表現です。",
      "suggestion": "内容を保持した上で短くできるか確認してください（自動置換しません）。"
    },
    {
      "rule_id": "VAGUE001",
      "severity": "REVIEW",
      "line": 7,
      "column": 29,
      "excerpt": "必要に応じて",
      "message": "基準が曖昧かもしれません。",
      "suggestion": "必要なら具体的な基準・条件・担当者を書いてください。"
    },
    {
      "rule_id": "VAGUE001",
      "severity": "REVIEW",
      "line": 7,
      "column": 35,
      "excerpt": "適切に",
      "message": "基準が曖昧かもしれません。",
      "suggestion": "必要なら具体的な基準・条件・担当者を書いてください。"
    }
  ]
}
